{
  "farhp_audit_archive_version": "0.8",
  "created_at": "2026-07-31T06:41:57.407Z",
  "study_id": "FARHP-DEPLOY-TEST",
  "session_id": "FARHP-DEPLOY-TEST-P-BROWSER-01-424242-1785480116753",
  "plan_fingerprint": {
    "algorithm": "FNV32x8-fallback",
    "value": "66f8276b03394b54114127813cf1e34a5dc2bd0ffa0c0f380827036503d6972e"
  },
  "consent_record": {
    "consent_version": "FARHP-CONSENT-TEST-v0.8",
    "consent_title": "Test consent",
    "consented_at": "2026-07-31T06:41:56.753Z",
    "affirmative_consent": true,
    "eligibility_attested": true,
    "withdrawal_code": "WD-01S6EWG",
    "plan_fingerprint": "66f8276b03394b54114127813cf1e34a5dc2bd0ffa0c0f380827036503d6972e"
  },
  "study_manifest_digest": "682f919a41068a15ef2bd074d39eafaf225e36e6d70343f1cb764fe00e5f68eb",
  "event_chain": {
    "algorithm": "SHA-256",
    "valid": true,
    "event_count": 8,
    "head": "18b2a76f3364a6d01d7cad7524a4384657f46e733b2975047c90ec69e78fb12a",
    "events": [
      {
        "index": 1,
        "timestamp": "2026-07-31T06:41:56.753Z",
        "type": "plan_bound",
        "payload": {
          "plan_fingerprint": "66f8276b03394b54114127813cf1e34a5dc2bd0ffa0c0f380827036503d6972e"
        },
        "prev_hash": "GENESIS",
        "hash": "6efbb8dfcd820d5cb2f9752110f2e6b697af830bc7f6bd48add3f0dd861f4132"
      },
      {
        "index": 2,
        "timestamp": "2026-07-31T06:41:56.763Z",
        "type": "consent_recorded",
        "payload": {
          "consent_version": "FARHP-CONSENT-TEST-v0.8"
        },
        "prev_hash": "6efbb8dfcd820d5cb2f9752110f2e6b697af830bc7f6bd48add3f0dd861f4132",
        "hash": "fc947cc2a83f89ebaf7bcbd460ee8ddd2c9f93de20380a470b7585d0a657aa29"
      },
      {
        "index": 3,
        "timestamp": "2026-07-31T06:41:56.763Z",
        "type": "session_started",
        "payload": {
          "session_id": "FARHP-DEPLOY-TEST-P-BROWSER-01-424242-1785480116753"
        },
        "prev_hash": "fc947cc2a83f89ebaf7bcbd460ee8ddd2c9f93de20380a470b7585d0a657aa29",
        "hash": "2a694f75daf968d8bfc4887fa475156af18c619171e863b4daa3f03bba08bd76"
      },
      {
        "index": 4,
        "timestamp": "2026-07-31T06:41:57.090Z",
        "type": "response_submitted",
        "payload": {
          "sequence_index": 1,
          "is_practice": true,
          "answer": "A",
          "rt_ms": 420
        },
        "prev_hash": "2a694f75daf968d8bfc4887fa475156af18c619171e863b4daa3f03bba08bd76",
        "hash": "5c30ab504586790393dbfb9ee1875bb91e23777c67d0264f6d91af7a79eddac5"
      },
      {
        "index": 5,
        "timestamp": "2026-07-31T06:41:57.093Z",
        "type": "response_submitted",
        "payload": {
          "sequence_index": 2,
          "is_practice": false,
          "answer": "B",
          "rt_ms": 650
        },
        "prev_hash": "5c30ab504586790393dbfb9ee1875bb91e23777c67d0264f6d91af7a79eddac5",
        "hash": "c6c4c216be6e767fbbd373f49fdaa87d991435d2907ca1bbfeaad630405f3f49"
      },
      {
        "index": 6,
        "timestamp": "2026-07-31T06:41:57.094Z",
        "type": "break_started",
        "payload": {
          "break_count": 1
        },
        "prev_hash": "c6c4c216be6e767fbbd373f49fdaa87d991435d2907ca1bbfeaad630405f3f49",
        "hash": "85eab388a97901b3fda4888671ceb121e077e06c16aa03c7cbd94d9acf87cfb5"
      },
      {
        "index": 7,
        "timestamp": "2026-07-31T06:41:57.282Z",
        "type": "response_submitted",
        "payload": {
          "sequence_index": 3,
          "is_practice": false,
          "answer": "B",
          "rt_ms": 850
        },
        "prev_hash": "85eab388a97901b3fda4888671ceb121e077e06c16aa03c7cbd94d9acf87cfb5",
        "hash": "af0eee1245c0f9c3921c4bbcab3f9155bac98ea653a77ad78e925610a92bbd59"
      },
      {
        "index": 8,
        "timestamp": "2026-07-31T06:41:57.284Z",
        "type": "session_completed",
        "payload": {
          "completed_at": "2026-07-31T06:41:57.284Z"
        },
        "prev_hash": "af0eee1245c0f9c3921c4bbcab3f9155bac98ea653a77ad78e925610a92bbd59",
        "hash": "18b2a76f3364a6d01d7cad7524a4384657f46e733b2975047c90ec69e78fb12a"
      }
    ]
  },
  "privacy_note": "archive contains an anonymous participant code; use deidentified export for analysis sharing",
  "archive_digest": {
    "algorithm": "FNV32x8-fallback",
    "value": "221f5ae60c07a9c741111d0438cac5cd4dd98382af831273202330309feadb09"
  }
}